,Company,Ticker,Stock Price,Trailing P/E Ratio,Shares Held by Institutions,% Float Held by Institutions,Forward Divident Yield,Forward Dividend,Last Year Dividend,2021 Dividend,2020 Dividend,2019 Dividend
0,American Airlines Group Inc. (AAL),AAL,16.83,2.81,55.52%,,,,0.0,0.0,0.1,0.4
1,Atlantic American Corporation (AAME),AAME,2.4900,17.43,5.62%,,0.85%,0.02,0.02,0.02,0.0,0.02
2,"Applied Optoelectronics, Inc. (AAOI)",AAOI,2.3500,,33.23%,,,,0.0,0.0,0.0,0.0
3,"AAON, Inc. (AAON)",AAON,76.74,59.35,71.75%,,0.63%,0.48,0.43,0.38,0.38,0.32
4,Apple Inc. (AAPL),AAPL,133.41,21.21,60.85%,,0.71%,0.92,0.91,0.865,0.8074999999999999,0.76
5,"Atlas Air Worldwide Holdings, Inc. (AAWW)",AAWW,101.82,8.13,115.19%,,,,0.0,0.0,0.0,0.0
6,Ameris Bancorp (ABCB),ABCB,48.97,9.70,90.30%,,1.24%,0.6,0.6,0.6,0.6,0.5
7,"ARCA biopharma, Inc. (ABIO)",ABIO,2.3500,,38.64%,,,,0.0,0.0,0.0,0.0
8,"Abiomed, Inc. (ABMD)",ABMD,381.02,65.36,97.09%,,,,0.0,0.0,0.0,0.0
9,ACADIA Pharmaceuticals Inc. (ACAD),ACAD,18.34,,95.10%,,,,0.0,0.0,0.0,0.0
10,"Adicet Bio, Inc. (ACET)",ACET,8.60,,110.21%,,,,0.0,0.0,0.0,0.0
11,"Acorn Energy, Inc. (ACFN)",ACFN,0.3810,,10.92%,,,,0.0,0.0,0.0,0.0
12,Arch Capital Group Ltd. (ACGL),ACGL,63.07,20.48,92.47%,,,,0.0,0.0,0.0,0.0
13,"Acadia Healthcare Company, Inc. (ACHC)",ACHC,83.98,26.96,104.30%,,,,0.0,0.0,0.0,0.0
14,Achison Inc. (ACHN),ACHN,0.1200,,0.00%,,,,0.0,0.0,0.0,0.0
15,"ACI Worldwide, Inc. (ACIW)",ACIW,26.97,19.77,101.01%,,,,0.0,0.0,0.0,0.0
16,"Axcelis Technologies, Inc. (ACLS)",ACLS,97.67,18.24,89.55%,,,,0.0,0.0,0.0,0.0
17,ACNB Corporation (ACNB),ACNB,38.58,11.12,29.45%,,2.93%,1.12,1.06,1.03,1.0,0.98
18,"Acorda Therapeutics, Inc. (ACOR)",ACOR,0.9284,0.94,25.80%,,,,0.0,0.0,0.0,0.0
19,"AcelRx Pharmaceuticals, Inc. (ACRX)",ACRX,2.5000,0.35,12.35%,,,,0.0,0.0,0.0,0.0
20,Acasti Pharma Inc. (ACST),ACST,0.7092,,0.21%,,,,0.0,0.0,0.0,0.0
21,Acacia Research Corporation (ACTG),ACTG,4.2900,8.23,61.75%,,,,0.0,0.0,0.0,0.0
22,"Acura Pharmaceuticals, Inc. (ACUR)",ACUR,0.0500,7.00,3.01%,,,,0.0,0.0,0.0,0.0
23,Adobe Inc. (ADBE),ADBE,344.54,32.95,85.36%,,,,0.0,0.0,0.0,0.0
24,"Advanced Emissions Solutions, Inc. (ADES)",ADES,2.5300,4.48,36.54%,,,,0.0,0.0,0.25,1.0
25,"Analog Devices, Inc. (ADI)",ADI,168.67,31.53,90.72%,,1.79%,3.04,3.04,2.76,2.48,2.16
26,"ADMA Biologics, Inc. (ADMA)",ADMA,3.5100,,71.97%,,,,0.0,0.0,0.0,0.0
27,Adamis Pharmaceuticals Corporation (ADMP),ADMP,0.2168,,8.64%,,,,0.0,0.0,0.0,0.0
28,"Automatic Data Processing, Inc. (ADP)",ADP,244.26,33.26,83.11%,,2.04%,5,4.37,3.83,3.66,3.2800000000000002
29,Adara Acquisition Corp. (ADRA),ADRA,9.90,85.08,88.81%,,,,0.0,0.0,0.0,0.0
30,"Autodesk, Inc. (ADSK)",ADSK,199.96,66.14,96.03%,,,,0.0,0.0,0.0,0.0
31,"ADTRAN Holdings, Inc. (ADTN)",ADTN,19.85,,90.07%,,1.83%,0.36,0.36,0.36,0.36,0.36
32,Addus HomeCare Corporation (ADUS),ADUS,102.64,36.85,101.58%,,,,0.0,0.0,0.0,0.0
33,"Advaxis, Inc. (ADXS)",ADXS,1.6000,,0.00%,,,,0.0,0.0,0.0,0.0
34,Aehr Test Systems (AEHR),AEHR,27.67,51.84,44.85%,,,,0.0,0.0,0.0,0.0
35,"Advanced Energy Industries, Inc. (AEIS)",AEIS,94.00,17.55,102.54%,,0.43%,0.4,0.4,0.4,0.0,0.0
36,"ADDvantage Technologies Group, Inc. (AEY)",AEY,1.5100,,4.39%,,,,0.0,0.0,0.0,0.0
37,Aeterna Zentaris Inc. (AEZS),AEZS,3.6600,,0.60%,,,,0.0,0.0,0.0,0.0
38,Affimed N.V. (AFMD),AFMD,1.1300,,66.20%,,,,0.0,0.0,0.0,0.0
39,Agenus Inc. (AGEN),AGEN,2.8700,,59.75%,,,,0.0,0.0,0.0,0.0
40,"Agios Pharmaceuticals, Inc. (AGIO)",AGIO,30.34,,105.27%,,,,0.0,0.0,0.0,0.0
41,AGNC Investment Corp. (AGNC),AGNC,11.28,,43.59%,,13.56%,1.44,1.4400000000000004,1.4400000000000004,1.5600000000000005,1.9999999999999996
42,AGNC Investment Corp. (AGNCP),AGNCP,20.36,,,,7.80%,1.53,1.532,1.532,1.149,0.0
43,"Agile Therapeutics, Inc. (AGRX)",AGRX,0.2992,,5.72%,,,,0.0,0.0,0.0,0.0
44,"Agilysys, Inc. (AGYS)",AGYS,80.54,238.62,101.94%,,,,0.0,0.0,0.0,0.0
45,"Allied Healthcare Products, Inc. (AHPI)",AHPI,1.0901,,4.14%,,,,0.0,0.0,0.0,0.0
46,Altra Industrial Motion Corp. (AIMC),AIMC,60.08,230.19,91.02%,,0.60%,0.36,0.35,0.30000000000000004,0.31,0.68
47,"Air T, Inc. (AIRT)",AIRT,27.21,173.43,25.74%,,,,0.0,0.0,0.0,0.0
48,"Akamai Technologies, Inc. (AKAM)",AKAM,88.64,27.52,95.34%,,,,0.0,0.0,0.0,0.0
49,"Akebia Therapeutics, Inc. (AKBA)",AKBA,0.6900,,29.16%,,,,0.0,0.0,0.0,0.0
50,"Alico, Inc. (ALCO)",ALCO,24.87,14.60,48.30%,,0.81%,0.2,1.55,1.68,0.45,0.27
51,"Aldeyra Therapeutics, Inc. (ALDX)",ALDX,6.77,,64.90%,,,,0.0,0.0,0.0,0.0
52,"Align Technology, Inc. (ALGN)",ALGN,235.58,34.12,90.53%,,,,0.0,0.0,0.0,0.0
53,Allegiant Travel Company (ALGT),ALGT,81.10,76.30,88.21%,,,,0.0,0.0,0.7,2.8
54,"Alimera Sciences, Inc. (ALIM)",ALIM,2.7500,,30.57%,,,,0.0,0.0,0.0,0.0
55,Alkermes plc (ALKS),ALKS,27.56,,99.58%,,,,0.0,0.0,0.0,0.0
56,Allot Ltd. (ALLT),ALLT,3.4000,,74.40%,,,,0.0,0.0,0.0,0.0
57,"Alnylam Pharmaceuticals, Inc. (ALNY)",ALNY,229.84,,97.70%,,,,0.0,0.0,0.0,0.0
58,"AstroNova, Inc. (ALOT)",ALOT,13.22,185.71,46.25%,,,,0.0,0.0,0.07,0.35000000000000003
59,Altair Engineering Inc. (ALTR),ALTR,49.85,,99.06%,,,,0.0,0.0,0.0,0.0
60,"Applied Materials, Inc. (AMAT)",AMAT,110.20,14.01,82.68%,,1.06%,1.04,1.02,0.94,0.87,0.83
61,"Ambarella, Inc. (AMBA)",AMBA,85.37,,81.57%,,,,0.0,0.0,0.0,0.0
62,"Ambac Financial Group, Inc. (AMBC)",AMBC,16.81,2.40,72.20%,,,,0.0,0.0,0.0,0.0
63,Andatee China Marine Fuel Services Corporation (AMCF),AMCF,0.0001,,0.00%,,,,0.0,0.0,0.0,0.0
64,AMC Networks Inc. (AMCX),AMCX,17.87,2.57,87.18%,,,,0.0,0.0,0.0,0.0
65,"Advanced Micro Devices, Inc. (AMD)",AMD,70.80,39.24,71.83%,,,,0.0,0.0,0.0,0.0
66,"Amedisys, Inc. (AMED)",AMED,83.60,22.32,99.85%,,,,0.0,0.0,0.0,0.0
67,Amgen Inc. (AMGN),AMGN,270.92,22.09,80.27%,,3.19%,8.52,7.76,7.04,6.4,5.8
68,"Amkor Technology, Inc. (AMKR)",AMKR,30.06,8.23,39.27%,,1.02%,0.3,0.22500000000000003,0.16999999999999998,0.04,0.0
69,American National Bankshares Inc. (AMNB),AMNB,36.97,10.30,40.49%,,3.30%,1.2,1.1400000000000001,1.09,1.08,1.04
70,Allied Motion Technologies Inc. (AMOT),AMOT,39.75,39.55,60.33%,,0.25%,0.1,0.1,0.095,0.08,0.08
71,"América Móvil, S.A.B. de C.V. (AMOV)",AMOV,20.25,14.50,5.22%,,3.20%,0.64,0.441,0.397,0.352,0.366
72,"Amphastar Pharmaceuticals, Inc. (AMPH)",AMPH,28.31,19.36,63.19%,,,,0.0,0.0,0.0,0.0
73,"A-Mark Precious Metals, Inc. (AMRK)",AMRK,38.36,5.91,50.36%,,2.10%,0.8,1.2,1.0,1.5,0.0
74,Amarin Corporation plc (AMRN),AMRN,1.9500,,31.33%,,,,0.0,0.0,0.0,0.0
75,"Amyris, Inc. (AMRS)",AMRS,1.4400,,38.79%,,,,0.0,0.0,0.0,0.0
76,American Superconductor Corporation (AMSC),AMSC,4.7300,,49.56%,,,,0.0,0.0,0.0,0.0
77,"AMERISAFE, Inc. (AMSF)",AMSF,52.37,26.21,99.00%,,2.39%,1.24,5.239999999999999,5.16,4.58,4.5
78,"American Software, Inc. (AMSWA)",AMSWA,14.99,47.55,78.03%,,3.03%,0.44,0.44,0.44,0.44,0.44
79,"Aemetis, Inc. (AMTX)",AMTX,4.3000,,59.11%,,,,0.0,0.0,0.0,0.0
80,American Woodmark Corporation (AMWD),AMWD,53.79,60.66,93.06%,,,,0.0,0.0,0.0,0.0
81,"Amazon.com, Inc. (AMZN)",AMZN,95.27,78.22,61.08%,,,,0.0,0.0,0.0,0.0
82,Arctos NorthStar Acquisition Corp. (ANAC),ANAC,10.13,32.88,90.17%,,,,0.0,0.0,0.0,0.0
83,"The Andersons, Inc. (ANDE)",ANDE,35.39,8.70,86.80%,,2.12%,0.74,0.7250000000000001,0.7049999999999998,0.7,0.685
84,Angi Inc. (ANGI),ANGI,2.8200,659.75,92.34%,,,,0.0,0.0,0.0,0.0
85,"Anika Therapeutics, Inc. (ANIK)",ANIK,31.11,43.00,93.78%,,,,0.0,0.0,0.0,0.0
86,"ANI Pharmaceuticals, Inc. (ANIP)",ANIP,43.00,77.58,75.40%,,,,0.0,0.0,0.0,0.0
87,"ANSYS, Inc. (ANSS)",ANSS,251.97,44.83,97.66%,,,,0.0,0.0,0.0,0.0
88,"Anthera Pharmaceuticals, Inc. (ANTH)",ANTH,0.0001,,0.00%,,,,0.0,0.0,0.0,0.0
89,Sphere 3D Corp. (ANY),ANY,0.4250,,7.91%,,,,0.0,0.0,0.0,0.0
90,Alpha and Omega Semiconductor Limited (AOSL),AOSL,31.04,1.83,68.76%,,,,0.0,0.0,0.0,0.0
91,"Applied DNA Sciences, Inc. (APDN)",APDN,1.6700,,14.31%,,,,0.0,0.0,0.0,0.0
92,"American Public Education, Inc. (APEI)",APEI,13.24,,93.08%,,,,0.0,0.0,0.0,0.0
93,"Apogee Enterprises, Inc. (APOG)",APOG,46.56,14.62,91.65%,,1.91%,0.88,0.88,0.8,0.752,0.7
94,Aptose Biosciences Inc. (APTO),APTO,0.6800,,26.73%,,,,0.0,0.0,0.0,0.0
95,Asia Pacific Wire & Cable Corporation Limited (APWC),APWC,1.4200,,0.98%,,,,0.0,0.0,0.0,0.0
96,Accuray Incorporated (ARAY),ARAY,2.3100,,65.37%,,,,0.0,0.0,0.0,0.0
97,ArcBest Corporation (ARCB),ARCB,78.64,6.00,91.47%,,0.62%,0.48,0.44,0.32,0.32,0.32
98,Ares Capital Corporation (ARCC),ARCC,19.61,10.95,32.33%,,9.94%,1.92,1.87,1.6199999999999999,1.6,1.68
99,"ARC Group Worldwide, Inc. (ARCW)",ARCW,0.9000,,0.00%,,,,0.0,0.0,0.0,0.0
100,"Ardelyx, Inc. (ARDX)",ARDX,2.9700,,41.37%,,,,0.0,0.0,0.0,0.0
101,"Aris Water Solutions, Inc. (ARIS)",ARIS,15.85,28.26,89.18%,,2.24%,0.36,0.42999999999999994,0.0,0.0,0.0
102,Ark Restaurants Corp. (ARKR),ARKR,17.67,6.47,17.06%,,2.97%,0.5,0.375,0.0,0.25,1.0
103,"Alliance Resource Partners, L.P. (ARLP)",ARLP,19.97,6.42,26.32%,,10.15%,2,1.5,0.4,0.4,2.145
104,Arrow Financial Corporation (AROW),AROW,33.78,11.83,44.99%,,3.24%,1.08,1.056408,1.009708,1.009708,0.987652
105,"Array Technologies, Inc. (ARRY)",ARRY,23.03,,110.54%,,,,0.0,0.0,0.0,0.0
106,Artesian Resources Corporation (ARTNA),ARTNA,59.37,30.45,56.73%,,1.88%,1.11,1.092,1.0470000000000002,1.0070000000000001,0.984
107,"Art's-Way Manufacturing Co., Inc. (ARTW)",ARTW,2.2300,21.78,5.47%,,,,0.0,0.0,0.0,0.0
108,"Arrowhead Pharmaceuticals, Inc. (ARWR)",ARWR,36.15,478.56,68.34%,,,,0.0,0.0,0.0,0.0
109,"Assembly Biosciences, Inc. (ASMB)",ASMB,1.5000,,34.34%,,,,0.0,0.0,0.0,0.0
110,ASML Holding N.V. (ASML),ASML,652.56,40.77,19.82%,,1.17%,6.63,6.929,3.9799999999999995,2.854,3.556
111,Altisource Portfolio Solutions S.A. (ASPS),ASPS,8.33,4.43,33.73%,,,,0.0,0.0,0.0,0.0
112,"AmeriServ Financial, Inc. (ASRV)",ASRV,3.9250,8.25,39.36%,,3.08%,0.12,0.11499999999999999,0.1,0.1,0.095
113,Astrotech Corporation (ASTC),ASTC,11.93,,18.91%,,,,0.0,0.0,0.0,0.0
114,"Astec Industries, Inc. (ASTE)",ASTE,38.85,,95.47%,,1.40%,0.52,0.49,0.45,0.55,0.44
115,"Ascent Solar Technologies, Inc. (ASTI)",ASTI,1.4300,,0.89%,,,,0.0,0.0,0.0,0.0
116,"Asure Software, Inc. (ASUR)",ASUR,10.19,,64.15%,,,,0.0,0.0,0.0,0.0
117,"Amtech Systems, Inc. (ASYS)",ASYS,9.25,7.05,67.63%,,,,0.0,0.0,0.0,0.0
118,Atai Life Sciences N.V. (ATAI),ATAI,1.8300,,35.12%,,,,0.0,0.0,0.0,0.0
119,"Alphatec Holdings, Inc. (ATEC)",ATEC,12.69,,50.91%,,,,0.0,0.0,0.0,0.0
120,"Athersys, Inc. (ATHX)",ATHX,1.2100,0.67,17.37%,,,,0.0,0.0,0.0,0.0
121,Atlanticus Holdings Corporation (ATLC),ATLC,30.13,4.09,15.12%,,,,0.0,0.0,0.0,0.0
122,Ames National Corporation (ATLO),ATLO,24.24,10.74,21.50%,,4.49%,1.08,1.07,1.03,0.99,0.95
123,"ATN International, Inc. (ATNI)",ATNI,46.74,,67.87%,,1.83%,0.84,0.72,0.68,0.68,0.68
124,"Atossa Therapeutics, Inc. (ATOS)",ATOS,0.7484,,21.52%,,,,0.0,0.0,0.0,0.0
125,"Atara Biotherapeutics, Inc. (ATRA)",ATRA,3.8600,,107.68%,,,,0.0,0.0,0.0,0.0
126,"AtriCure, Inc. (ATRC)",ATRC,42.14,,99.61%,,,,0.0,0.0,0.0,0.0
127,Atrion Corporation (ATRI),ATRI,614.28,29.95,65.83%,,1.45%,8.6,8.2,7.4,6.6,5.8
128,Astronics Corporation (ATRO),ATRO,10.97,5.56,71.46%,,,,0.0,0.0,0.0,0.0
129,"Air Transport Services Group, Inc. (ATSG)",ATSG,27.49,10.84,98.52%,,,,0.0,0.0,0.0,0.0
130,"Activision Blizzard, Inc. (ATVI)",ATVI,76.90,36.43,84.16%,,0.61%,0.47,0.47,0.47,0.41,0.37
131,"Auburn National Bancorporation, Inc. (AUBN)",AUBN,23.00,10.45,8.13%,,4.61%,1.06,1.06,1.04,1.02,1.0
132,AudioCodes Ltd. (AUDC),AUDC,18.50,20.65,44.93%,,1.97%,0.36,0.36,0.33,0.27,0.22999999999999998
133,Aurinia Pharmaceuticals Inc. (AUPH),AUPH,8.77,,41.98%,,,,0.0,0.0,0.0,0.0
134,"AeroVironment, Inc. (AVAV)",AVAV,88.20,,90.92%,,,,0.0,0.0,0.0,0.0
135,"AVEO Pharmaceuticals, Inc. (AVEO)",AVEO,14.97,84.80,34.39%,,,,0.0,0.0,0.0,0.0
136,Broadcom Inc. (AVGO),AVGO,581.94,22.23,83.28%,,3.13%,18.4,16.9,14.9,13.35,11.2
137,Achari Ventures Holdings Corp. I (AVHI),AVHI,10.47,,83.26%,,,,0.0,0.0,0.0,0.0
138,"Avid Technology, Inc. (AVID)",AVID,28.88,27.59,91.26%,,,,0.0,0.0,0.0,0.0
139,"Aviat Networks, Inc. (AVNW)",AVNW,31.92,26.23,77.01%,,,,0.0,0.0,0.0,0.0
140,"Aware, Inc. (AWRE)",AWRE,1.7700,,33.07%,,,,0.0,0.0,0.0,0.0
141,Abraxas Petroleum Corporation (AXAS),AXAS,0.7999,0.19,90.00%,,,,0.0,0.0,0.0,0.0
142,"Accelerate Diagnostics, Inc. (AXDX)",AXDX,0.6870,,27.72%,,,,0.0,0.0,0.0,0.0
143,"AxoGen, Inc. (AXGN)",AXGN,9.49,,76.91%,,,,0.0,0.0,0.0,0.0
144,"AXT, Inc. (AXTI)",AXTI,5.23,12.61,57.36%,,,,0.0,0.0,0.0,0.0
145,"Aspen Technology, Inc. (AZPN)",AZPN,203.28,,49.11%,,,,0.0,0.0,0.0,0.0
146,BancFirst Corporation (BANF),BANF,89.51,16.31,52.90%,,1.84%,1.6,1.52,1.4,1.32,1.24
147,BFC Capital Trust II PFD TR 7.20% (BANFP),BANFP,27.78,,,,,,1.35,1.8,1.8,1.8
148,Banner Corporation (BANR),BANR,64.70,11.51,87.78%,,2.78%,1.76,1.76,1.64,2.64,1.6099999999999999
149,ArrowMark Financial Corp. (BANX),BANX,18.78,24.33,25.30%,,8.22%,1.56,1.66,1.62,1.57,1.52
150,Bed Bath & Beyond Inc. (BBBY),BBBY,5.24,,41.06%,,,,0.0,0.0,0.17,0.67
151,"Beasley Broadcast Group, Inc. (BBGI)",BBGI,0.9750,15.64,24.86%,,,,0.0,0.0,0.05,0.2
152,"Barrett Business Services, Inc. (BBSI)",BBSI,96.92,14.92,88.16%,,1.26%,1.2,1.2,1.2,1.2,1.1
153,"BCB Bancorp, Inc. (BCBP)",BCBP,18.22,7.28,41.39%,,3.59%,0.64,0.64,0.6000000000000001,0.56,0.56
154,Brainstorm Cell Therapeutics Inc. (BCLI),BCLI,1.5600,,10.58%,,,,0.0,0.0,0.0,0.0
155,"Blucora, Inc. (BCOR)",BCOR,27.22,45.40,95.13%,,,,0.0,0.0,0.0,0.0
156,Brightcove Inc. (BCOV),BCOV,5.86,,88.28%,,,,0.0,0.0,0.0,0.0
157,Balchem Corporation (BCPC),BCPC,127.67,36.27,91.81%,,0.56%,0.71,0.71,0.64,0.58,0.52
158,"BioCryst Pharmaceuticals, Inc. (BCRX)",BCRX,10.32,,81.17%,,,,0.0,0.0,0.0,0.0
159,"BioDelivery Sciences International, Inc. (BDSI)",BDSI,5.59,6.82,,,,,0.0,0.0,0.0,0.0
160,"HeartBeam, Inc. (BEAT)",BEAT,4.2200,,15.45%,,,,0.0,0.0,0.0,0.0
161,"bebe stores, inc. (BEBE)",BEBE,4.9601,3.14,0.00%,,12.10%,0.6,0.6,0.42000000000000004,0.35000000000000003,0.5900000000000001
162,"Beacon Roofing Supply, Inc. (BECN)",BECN,53.92,,104.14%,,,,0.0,0.0,0.0,0.0
163,Bel Fuse Inc. (BELFA),BELFA,33.45,8.31,40.07%,,0.72%,0.24,0.24,0.24,0.24,0.24
164,Bel Fuse Inc. (BELFB),BELFB,34.62,8.76,61.29%,,0.81%,0.28,0.28,0.28,0.28,0.28
165,BankFinancial Corporation (BFIN),BFIN,10.41,14.47,61.21%,,3.86%,0.4,0.4,0.4,0.4,0.4
166,"BGC Partners, Inc. (BGCP)",BGCP,4.1800,12.53,67.96%,,0.96%,0.04,0.04,0.04,0.17000000000000004,0.56
167,Big 5 Sporting Goods Corporation (BGFV),BGFV,9.84,4.62,47.29%,,10.30%,1,1.0,2.83,0.25,0.2
168,"BG Medicine, Inc. (BGMD)",BGMD,0.0001,,0.00%,,,,0.0,0.0,0.0,0.0
169,"Baidu, Inc. (BIDU)",BIDU,136.52,,31.66%,,,,0.0,0.0,0.0,0.0
170,Biogen Inc. (BIIB),BIIB,288.08,14.27,89.77%,,,,0.0,0.0,0.0,0.0
171,"Biocept, Inc. (BIOC)",BIOC,0.5500,,10.03%,,,,0.0,0.0,0.0,0.0
172,"BIOLASE, Inc. (BIOL)",BIOL,0.4300,,20.66%,,,,0.0,0.0,0.0,0.0
173,BioPlus Acquisition Corp. (BIOS),BIOS,10.29,,88.18%,,,,0.0,0.0,0.0,0.0
174,"BJ's Restaurants, Inc. (BJRI)",BJRI,30.63,12.28,100.50%,,,,0.0,0.0,0.13,0.49
175,BlackRock Capital Investment Corporation (BKCC),BKCC,3.7900,17.38,28.41%,,10.61%,0.4,0.4,0.4,0.28,0.64
176,Bank of South Carolina Corporation (BKSC),BKSC,16.50,14.51,7.61%,,4.15%,0.68,0.68,0.7800000000000001,0.66,0.89
177,"Bellicum Pharmaceuticals, Inc. (BLCM)",BLCM,0.9900,,31.44%,,,,0.0,0.0,0.0,0.0
178,Ballard Power Systems Inc. (BLDP),BLDP,5.92,,34.79%,,,,0.0,0.0,0.0,0.0
179,"Builders FirstSource, Inc. (BLDR)",BLDR,70.22,4.13,104.26%,,,,0.0,0.0,0.0,0.0
180,"BioLife Solutions, Inc. (BLFS)",BLFS,23.47,,93.69%,,,,0.0,0.0,0.0,0.0
181,"Bridgeline Digital, Inc. (BLIN)",BLIN,1.1550,5.45,10.52%,,,,0.0,0.0,0.0,0.0
182,"Blackbaud, Inc. (BLKB)",BLKB,61.80,,99.85%,,,,0.0,0.0,0.12,0.48
183,"Bloomin' Brands, Inc. (BLMN)",BLMN,23.70,21.25,108.52%,,2.39%,0.56,0.56,0.0,0.2,0.4
184,BioLineRx Ltd. (BLRX),BLRX,0.6781,,19.75%,,,,0.0,0.0,0.0,0.0
185,"bluebird bio, Inc. (BLUE)",BLUE,8.22,,81.77%,,,,0.0,0.0,0.0,0.0
186,Bank of Marin Bancorp (BMRC),BMRC,32.83,12.03,50.05%,,3.10%,1,0.98,0.94,0.92,0.7999999999999999
187,BioMarin Pharmaceutical Inc. (BMRN),BMRN,113.57,252.81,101.04%,,,,0.0,0.0,0.0,0.0
188,"Benefitfocus, Inc. (BNFT)",BNFT,10.48,,73.74%,,,,0.0,0.0,0.0,0.0
189,Bonso Electronics International Inc. (BNSO),BNSO,3.9400,,2.58%,,,,0.0,0.0,0.0,0.0
190,BOK Financial Corporation (BOKF),BOKF,102.96,14.90,38.32%,,2.09%,2.16,2.66,2.09,2.05,2.01
191,DMC Global Inc. (BOOM),BOOM,21.99,17.08,88.36%,,,,0.0,0.0,0.125,0.29000000000000004
192,B.O.S. Better Online Solutions Ltd. (BOSC),BOSC,2.1600,13.40,14.23%,,,,0.0,0.0,0.0,0.0
193,"Bank of the James Financial Group, Inc. (BOTJ)",BOTJ,12.63,6.42,25.46%,,2.47%,0.32,0.29000000000000004,0.267272,0.254544,0.254544
194,"Popular, Inc. (BPOP)",BPOP,68.45,5.01,88.99%,,3.21%,2.2,2.2,1.75,1.6,1.2
195,Popular Capital Trust II PFD GTD 6.125% (BPOPM),BPOPM,25.00,,,,,,0.0,0.64,1.5360000000000005,0.896
196,"Bio-Path Holdings, Inc. (BPTH)",BPTH,1.7200,,5.78%,,,,0.0,0.0,0.0,0.0
197,Bridgford Foods Corporation (BRID),BRID,13.12,3.05,5.44%,,,,0.0,0.0,0.0,0.0
198,"Brookline Bancorp, Inc. (BRKL)",BRKL,13.84,9.89,74.30%,,3.88%,0.54,0.52,0.48,0.46,0.44
199,Bruker Corporation (BRKR),BRKR,67.86,37.47,72.45%,,0.29%,0.2,0.2,0.16,0.16,0.16
200,Brilliant Acquisition Corporation (BRLI),BRLI,10.74,,88.27%,,,,0.0,0.0,0.0,0.0
201,"Bassett Furniture Industries, Incorporated (BSET)",BSET,18.15,6.50,60.92%,,3.65%,0.64,2.1,0.53,0.705,0.5
202,"Biostar Pharmaceuticals, Inc. (BSPM)",BSPM,0.0000,0.18,0.00%,,,,0.0,0.0,0.0,0.0
203,BSQUARE Corporation (BSQR),BSQR,1.1900,,13.72%,,,,0.0,0.0,0.0,0.0
204,Sierra Bancorp (BSRR),BSRR,21.26,8.92,53.51%,,4.37%,0.92,0.92,0.86,0.8,0.74
205,Burford Capital Limited (BUR),BUR,9.17,325.84,72.92%,,1.36%,0.12,0.126,0.188,0.0,0.0
206,First Busey Corporation (BUSE),BUSE,24.97,11.26,51.44%,,3.75%,0.92,0.92,0.92,0.88,0.84
207,"BrightView Holdings, Inc. (BV)",BV,7.61,52.64,94.41%,,,,0.0,0.0,0.0,0.0
208,"Broadwind, Inc. (BWEN)",BWEN,4.4100,,25.07%,,,,0.0,0.0,0.0,0.0
209,"Bankwell Financial Group, Inc. (BWFG)",BWFG,30.15,6.04,43.47%,,2.83%,0.8,0.8,0.64,0.56,0.52
210,Broadway Financial Corporation (BYFC),BYFC,1.0400,24.25,15.83%,,,,0.0,0.0,0.0,0.0
211,"China Automotive Systems, Inc. (CAAS)",CAAS,6.80,8.07,3.08%,,,,0.0,0.0,0.0,0.0
212,Camden National Corporation (CAC),CAC,42.20,10.00,70.18%,,4.05%,1.68,1.6,1.4099999999999997,1.32,1.2
213,Credit Acceptance Corporation (CACC),CACC,418.47,9.03,61.35%,,,,0.0,0.0,0.0,0.0
214,"Cache, Inc. (CACH)",CACH,0.0001,,0.00%,,,,0.0,0.0,0.0,0.0
215,The Cheesecake Factory Incorporated (CAKE),CAKE,38.06,36.52,91.54%,,2.81%,1.08,0.81,0.0,0.36,1.38
216,"Calithera Biosciences, Inc. (CALA)",CALA,0.5157,,37.94%,,,,0.0,0.0,0.0,0.0
217,"Cal-Maine Foods, Inc. (CALM)",CALM,54.74,9.71,95.07%,,5.74%,3.08,1.7269999999999999,0.034,0.0,0.42100000000000004
218,CalAmp Corp. (CAMP),CAMP,4.9100,,77.45%,,,,0.0,0.0,0.0,0.0
219,Camtek Ltd. (CAMT),CAMT,24.98,15.63,28.00%,,,,0.0,0.0,0.0,0.17
220,"Avis Budget Group, Inc. (CAR)",CAR,189.34,3.16,104.42%,,,,0.0,0.0,0.0,0.0
221,"Cara Therapeutics, Inc. (CARA)",CARA,10.54,,66.86%,,,,0.0,0.0,0.0,0.0
222,"Carver Bancorp, Inc. (CARV)",CARV,4.8501,,15.88%,,,,0.0,0.0,0.0,0.0
223,"Pathward Financial, Inc. (CASH)",CASH,46.39,8.66,90.02%,,0.43%,0.2,0.2,0.2,0.2,0.2
224,"CASI Pharmaceuticals, Inc. (CASI)",CASI,2.0300,,14.80%,,,,0.0,0.0,0.0,0.0
225,"Cass Information Systems, Inc. (CASS)",CASS,48.72,19.98,58.09%,,2.37%,1.16,1.1300000000000001,1.09,1.08,1.05
226,"Casey's General Stores, Inc. (CASY)",CASY,221.08,20.14,87.36%,,0.69%,1.52,1.46,1.37,1.28,1.22
227,Cathay General Bancorp (CATY),CATY,43.02,9.27,70.89%,,3.22%,1.36,1.36,1.27,1.24,1.24
228,"CymaBay Therapeutics, Inc. (CBAY)",CBAY,6.15,,76.32%,,,,0.0,0.0,0.0,0.0
229,"CB Financial Services, Inc. (CBFV)",CBFV,22.13,8.25,30.24%,,4.34%,0.96,0.96,0.96,0.96,0.96
